{
  "knowledgeVersion": "0.1.0",
  "meta": {
    "generator": "hand-authored fixture",
    "contentHash": "sha256:0000000000000000000000000000000000000000000000000000000000000000"
  },
  "project": {
    "id": "orderflow",
    "name": "OrderFlow",
    "purpose": "Automate purchase-order approval for mid-size distributors.",
    "problem": "Approvals take 4 days on average and stall in email threads.",
    "solution": "A rules engine plus an approval UI wired to the ERP.",
    "status": "Pilot with two customers since 2026-06.",
    "nextSteps": ["Add SSO", "Onboard third pilot customer"],
    "tags": ["b2b", "workflow"],
    "sourceRefs": [{ "sourceId": "brief", "locator": { "kind": "page", "page": 1 } }]
  },
  "sources": [
    { "id": "brief", "kind": "pdf", "title": "OrderFlow product brief", "uri": "./docs/brief.pdf" },
    {
      "id": "repo",
      "kind": "repo",
      "title": "orderflow monorepo",
      "uri": "https://example.invalid/orderflow"
    },
    { "id": "metrics-sheet", "kind": "json", "title": "pilot-metrics.json" }
  ],
  "capabilities": [
    {
      "id": "cap-rules",
      "name": "Configurable approval rules",
      "description": "Thresholds by amount, vendor and cost center.",
      "sourceRefs": [{ "sourceId": "brief", "locator": { "kind": "fragment", "anchor": "Rules" } }]
    }
  ],
  "components": [
    {
      "id": "cmp-api",
      "name": "Approval API",
      "kind": "service",
      "responsibilities": ["Evaluate rules", "Expose approval endpoints"],
      "technologies": ["tech-node"],
      "sourceRefs": [
        { "sourceId": "repo", "locator": { "kind": "file", "path": "services/api/README.md" } }
      ]
    },
    {
      "id": "cmp-ui",
      "name": "Approver console",
      "kind": "ui",
      "sourceRefs": [
        { "sourceId": "repo", "locator": { "kind": "file", "path": "apps/console/package.json" } }
      ]
    }
  ],
  "actors": [
    {
      "id": "act-approver",
      "name": "Approver",
      "type": "human",
      "sourceRefs": [{ "sourceId": "brief" }]
    }
  ],
  "dependencies": [
    {
      "id": "dep-erp",
      "name": "Acme ERP",
      "scope": "service",
      "sourceRefs": [{ "sourceId": "brief" }]
    }
  ],
  "processes": [
    {
      "id": "proc-approve",
      "name": "Approve a purchase order",
      "trigger": "PO submitted in ERP",
      "steps": [
        { "label": "Ingest PO", "detail": "Webhook from ERP" },
        { "label": "Evaluate rules" },
        { "label": "Route to approver" }
      ],
      "outcome": "PO marked approved or rejected in ERP.",
      "sourceRefs": [{ "sourceId": "brief", "locator": { "kind": "page", "page": 2 } }]
    }
  ],
  "phases": [
    {
      "id": "ph-mvp",
      "name": "MVP",
      "status": "done",
      "start": "2026-01",
      "end": "2026-05",
      "sourceRefs": [{ "sourceId": "brief" }]
    },
    {
      "id": "ph-pilot",
      "name": "Pilot",
      "status": "active",
      "start": "2026-06",
      "sourceRefs": [{ "sourceId": "brief" }]
    }
  ],
  "milestones": [
    {
      "id": "ms-first-pilot",
      "name": "First pilot live",
      "date": "2026-06-15",
      "achieved": true,
      "phaseId": "ph-pilot",
      "sourceRefs": [{ "sourceId": "brief" }]
    }
  ],
  "metrics": [
    {
      "id": "met-cycle",
      "name": "Approval cycle time",
      "value": "1.2",
      "unit": "days",
      "baseline": "4 days",
      "asOf": "2026-08",
      "direction": "down-good",
      "sourceRefs": [
        {
          "sourceId": "metrics-sheet",
          "locator": { "kind": "text-range", "charStart": 0, "charEnd": 40 }
        }
      ]
    }
  ],
  "risks": [
    {
      "id": "risk-erp-api",
      "statement": "ERP vendor may rate-limit the approval webhook.",
      "likelihood": "medium",
      "impact": "high",
      "mitigation": "Batch polling fallback.",
      "factType": "INFERENCE",
      "sourceRefs": [{ "sourceId": "brief" }]
    }
  ],
  "decisions": [
    {
      "id": "dec-node",
      "statement": "Build the API in Node.js.",
      "rationale": "Team expertise.",
      "status": "accepted",
      "sourceRefs": [{ "sourceId": "repo" }]
    }
  ],
  "requirements": [
    {
      "id": "req-audit",
      "statement": "Every approval action must be auditable.",
      "kind": "non-functional",
      "priority": "must",
      "sourceRefs": [{ "sourceId": "brief" }]
    }
  ],
  "technologies": [
    {
      "id": "tech-node",
      "name": "Node.js",
      "category": "runtime",
      "sourceRefs": [{ "sourceId": "repo" }]
    }
  ],
  "results": [
    {
      "id": "res-cycle",
      "statement": "Cycle time fell from 4 days to 1.2 days in pilot.",
      "metricId": "met-cycle",
      "sourceRefs": [{ "sourceId": "metrics-sheet" }]
    }
  ],
  "constraints": [
    {
      "id": "con-onprem",
      "statement": "Must run in the customer's VPC.",
      "kind": "technical",
      "sourceRefs": [{ "sourceId": "brief" }]
    }
  ],
  "relations": [
    {
      "id": "rel-ui-api",
      "from": "cmp-ui",
      "to": "cmp-api",
      "type": "DEPENDS_ON",
      "sourceRefs": [{ "sourceId": "repo" }]
    },
    {
      "id": "rel-api-erp",
      "from": "cmp-api",
      "to": "dep-erp",
      "type": "CONSUMES",
      "sourceRefs": [{ "sourceId": "brief" }]
    },
    {
      "id": "rel-proc-cap",
      "from": "proc-approve",
      "to": "cap-rules",
      "type": "IMPLEMENTS",
      "sourceRefs": [{ "sourceId": "brief" }]
    }
  ],
  "claims": [
    {
      "id": "clm-cycle",
      "statement": "Approval cycle time dropped by 70% in the pilot.",
      "factType": "FACT",
      "confidence": 0.9,
      "sourceRefs": [{ "sourceId": "metrics-sheet", "quote": "avg cycle 1.2d vs 4d baseline" }],
      "supports": ["res-cycle"]
    },
    {
      "id": "clm-scale",
      "statement": "The rules engine will scale to 10k POs/day.",
      "factType": "INFERENCE",
      "confidence": 0.5,
      "sourceRefs": [
        {
          "sourceId": "repo",
          "locator": {
            "kind": "file",
            "path": "services/api/bench/results.md",
            "lineStart": 3,
            "lineEnd": 20
          }
        }
      ]
    }
  ],
  "gaps": [
    {
      "id": "gap-sso",
      "question": "Which SSO providers must the console support at GA?",
      "why": "Not covered by the brief.",
      "blocks": ["cmp-ui"],
      "severity": "medium"
    }
  ]
}
