{
  "knowledgeVersion": "0.1.0",
  "project": {
    "id": "arclume",
    "name": "Arclume",
    "purpose": "Turn project knowledge into presentation decks.",
    "sourceRefs": [{ "sourceId": "readme" }]
  },
  "sources": [{ "id": "readme", "kind": "markdown", "title": "README.md", "uri": "./README.md" }],
  "capabilities": [],
  "components": [],
  "actors": [],
  "dependencies": [],
  "processes": [],
  "phases": [],
  "milestones": [],
  "metrics": [],
  "risks": [],
  "decisions": [],
  "requirements": [],
  "technologies": [],
  "results": [],
  "constraints": [],
  "relations": [],
  "claims": [],
  "gaps": []
}
