{
  "knowledgeVersion": "0.1.0",
  "meta": {
    "generator": "hand-authored fixture",
    "contentHash": "sha256:1111111111111111111111111111111111111111111111111111111111111111"
  },
  "project": {
    "id": "tinytool",
    "name": "TinyTool",
    "purpose": "Give a small team a one-command way to tidy up their notes.",
    "sourceRefs": [{ "sourceId": "readme" }]
  },
  "sources": [{ "id": "readme", "kind": "markdown", "title": "README.md", "uri": "./README.md" }],
  "capabilities": [
    {
      "id": "cap-format",
      "name": "Reformat notes to a house style",
      "sourceRefs": [{ "sourceId": "readme" }]
    },
    {
      "id": "cap-index",
      "name": "Build a table of contents",
      "sourceRefs": [{ "sourceId": "readme" }]
    }
  ],
  "components": [],
  "actors": [],
  "dependencies": [],
  "processes": [],
  "phases": [],
  "milestones": [],
  "metrics": [],
  "risks": [],
  "decisions": [],
  "requirements": [],
  "technologies": [],
  "results": [],
  "constraints": [],
  "relations": [],
  "claims": [],
  "gaps": [
    {
      "id": "gap-scale",
      "question": "How large a notes folder can TinyTool handle before it is too slow?",
      "why": "No performance work has been done yet.",
      "severity": "low"
    }
  ]
}
