{
  "knowledgeVersion": "0.1.0",
  "project": {
    "id": "checkout",
    "name": "Checkout",
    "purpose": "A three-party authorization handshake.",
    "sourceRefs": [{ "sourceId": "spec" }]
  },
  "sources": [{ "id": "spec", "kind": "markdown", "title": "spec.md", "uri": "./spec.md" }],
  "capabilities": [],
  "components": [
    { "id": "cmp-web", "name": "Web UI", "kind": "ui", "sourceRefs": [{ "sourceId": "spec" }] },
    {
      "id": "cmp-api",
      "name": "Checkout API",
      "kind": "service",
      "sourceRefs": [{ "sourceId": "spec" }]
    },
    {
      "id": "cmp-psp",
      "name": "Payment Provider",
      "kind": "external",
      "sourceRefs": [{ "sourceId": "spec" }]
    }
  ],
  "actors": [],
  "dependencies": [],
  "processes": [],
  "phases": [],
  "milestones": [],
  "metrics": [],
  "risks": [],
  "decisions": [],
  "requirements": [],
  "technologies": [],
  "results": [],
  "constraints": [],
  "relations": [
    {
      "id": "rel-web-api",
      "from": "cmp-web",
      "to": "cmp-api",
      "type": "PRECEDES",
      "label": "submit order",
      "sourceRefs": [{ "sourceId": "spec" }]
    },
    {
      "id": "rel-api-psp",
      "from": "cmp-api",
      "to": "cmp-psp",
      "type": "PRECEDES",
      "label": "authorize",
      "sourceRefs": [{ "sourceId": "spec" }]
    },
    {
      "id": "rel-psp-api",
      "from": "cmp-psp",
      "to": "cmp-api",
      "type": "PRECEDES",
      "label": "auth result",
      "sourceRefs": [{ "sourceId": "spec" }]
    }
  ],
  "claims": [],
  "gaps": []
}
